{
  "build_provenance": {
    "dependencies": {
      "docling": "2.113.0",
      "docling-core": "2.87.1",
      "jsonschema": "4.26.0",
      "markitdown": "0.1.6"
    },
    "generator_id": "tools.generate_diagnosis_fixtures",
    "lockfile_sha256": "2a06114acb4804c445ff5d562123c7ef9930f86d18bf98d6d51fb615e40f5cca",
    "package_version": "0.5.0",
    "provenance_id": "f27bf80e8a5c17a5ea7567ccdca6335d955f09a616ac4ec750567a1e98715f04",
    "python": {
      "implementation": "CPython",
      "major_minor": "3.12"
    }
  },
  "fixtures": [
    {
      "expected_rules": [
        "TCW-D002"
      ],
      "id": "short-note",
      "license": "CC0-1.0",
      "path": "fixtures/diagnosis/v0.5/short-note.md",
      "sha256": "e1a31719c539bd0a6aed98863180fe55e1b4cb8b2571d574c5708ff07c6f2feb",
      "size": 43
    },
    {
      "expected_rules": [
        "TCW-D003",
        "TCW-D004",
        "TCW-D005"
      ],
      "id": "structural-traps",
      "license": "CC0-1.0",
      "path": "fixtures/diagnosis/v0.5/structural-traps.md",
      "sha256": "bc1ce1118bfe590cc9f87467d85cb43d14462aa4e5b0cafcdf8338220e8f194f",
      "size": 471
    },
    {
      "expected_rules": [
        "TCW-D007"
      ],
      "id": "repeated-margin",
      "license": "CC0-1.0",
      "path": "fixtures/diagnosis/v0.5/repeated-margin.pdf",
      "sha256": "9a49257727a1e81609e2bad40a6119afb8bf5dc011e4aa242b78ee30fe5878e6",
      "size": 2683
    }
  ],
  "generator": "tools/generate_diagnosis_fixtures.py",
  "schema_version": "tcw.diagnosis-fixture-registry/v0.5"
}
